{
  "$schema": "./openclaw.schema.json",
  "gateway": {
    "bind": "loopback",
    "port": 18789,
    "auth": {
      "required": true,
      "secret": "${OPENCLAW_GATEWAY_SECRET}"
    }
  },
  "env": {
    "file": "~/.openclaw/.env"
  },
  "agents": {
    "defaults": {
      "model": {
        "primary": "openai/gpt-5-nano",
        "fallbacks": [
          "anthropic/claude-haiku-4-5",
          "openrouter/google/gemini-2.5-flash-lite",
          "openrouter/openai/gpt-oss-120b:free"
        ]
      },
      "heartbeat": {
        "model": "google/gemini-2.5-flash-lite",
        "interval": 1800,
        "directPolicy": "block"
      },
      "sandbox": {
        "mode": "all",
        "workspaceAccess": "none",
        "docker": {
          "network": "none",
          "image": "node:22-alpine",
          "memory": "256m",
          "cpus": "0.5"
        }
      }
    },
    "list": [
      {
        "id": "main",
        "default": true,
        "workspace": "~/.openclaw/workspace"
      }
    ]
  },
  "skills": {
    "autoLoad": true,
    "directory": "~/.openclaw/workspace/skills",
    "sandboxFirstRun": true
  }
}
